{
  "$schema": "https://frabcd.github.io/codex-ai-game-studio/schemas/catalog-snapshot.schema.json",
  "schema_version": "1.0.0",
  "snapshot_date": "2026-07-30",
  "source": "Approximate values explicitly present in the verified landscape; missing fields remain null until a reviewed refresh.",
  "records": [
    {
      "id": "0x0funky-agent-sprite-forge",
      "stars": 3500,
      "archived": null,
      "latest_release": null,
      "last_activity": null,
      "retrieval": "approximate-source-snapshot"
    },
    {
      "id": "3dtopia-3dtopia-xl",
      "stars": null,
      "archived": null,
      "latest_release": null,
      "last_activity": null,
      "retrieval": "not-recorded"
    },
    {
      "id": "3dtopia-lgm",
      "stars": null,
      "archived": null,
      "latest_release": null,
      "last_activity": null,
      "retrieval": "not-recorded"
    },
    {
      "id": "a16z-infra-ai-town",
      "stars": null,
      "archived": null,
      "latest_release": null,
      "last_activity": null,
      "retrieval": "not-recorded"
    },
    {
      "id": "adriankhl-godot-llm",
      "stars": null,
      "archived": null,
      "latest_release": null,
      "last_activity": null,
      "retrieval": "not-recorded"
    },
    {
      "id": "ahujasid-blender-mcp",
      "stars": 25100,
      "archived": null,
      "latest_release": null,
      "last_activity": null,
      "retrieval": "approximate-source-snapshot"
    },
    {
      "id": "aiuniai-unique3d",
      "stars": null,
      "archived": null,
      "latest_release": null,
      "last_activity": null,
      "retrieval": "not-recorded"
    },
    {
      "id": "akikurisu-next-gen-dialogue",
      "stars": null,
      "archived": null,
      "latest_release": null,
      "last_activity": null,
      "retrieval": "not-recorded"
    },
    {
      "id": "amidos2006-gym-pcgrl",
      "stars": null,
      "archived": null,
      "latest_release": null,
      "last_activity": null,
      "retrieval": "not-recorded"
    },
    {
      "id": "amtarr-comfyui-texturealchemy",
      "stars": null,
      "archived": null,
      "latest_release": null,
      "last_activity": null,
      "retrieval": "not-recorded"
    },
    {
      "id": "anil-matcha-awesome-ai-game-generation",
      "stars": null,
      "archived": null,
      "latest_release": null,
      "last_activity": null,
      "retrieval": "not-recorded"
    },
    {
      "id": "anklebreaker-studio-unity-mcp-plugin",
      "stars": null,
      "archived": null,
      "latest_release": null,
      "last_activity": null,
      "retrieval": "not-recorded"
    },
    {
      "id": "anklebreaker-studio-unity-mcp-server",
      "stars": null,
      "archived": null,
      "latest_release": null,
      "last_activity": null,
      "retrieval": "not-recorded"
    },
    {
      "id": "aseprite-aseprite",
      "stars": null,
      "archived": null,
      "latest_release": null,
      "last_activity": null,
      "retrieval": "not-recorded"
    },
    {
      "id": "ashawkey-intex",
      "stars": null,
      "archived": null,
      "latest_release": null,
      "last_activity": null,
      "retrieval": "not-recorded"
    },
    {
      "id": "ashawkey-stable-dreamfusion",
      "stars": null,
      "archived": null,
      "latest_release": null,
      "last_activity": null,
      "retrieval": "not-recorded"
    },
    {
      "id": "assimp-assimp",
      "stars": null,
      "archived": null,
      "latest_release": null,
      "last_activity": null,
      "retrieval": "not-recorded"
    },
    {
      "id": "automatic1111-stable-diffusion-webui",
      "stars": null,
      "archived": null,
      "latest_release": null,
      "last_activity": null,
      "retrieval": "not-recorded"
    },
    {
      "id": "aws-solutions-library-samples-guidance-for-dynamic-game-npc-dialogue-on-aws",
      "stars": null,
      "archived": null,
      "latest_release": null,
      "last_activity": null,
      "retrieval": "not-recorded"
    },
    {
      "id": "baai-agents-cradle",
      "stars": null,
      "archived": null,
      "latest_release": null,
      "last_activity": null,
      "retrieval": "not-recorded"
    },
    {
      "id": "balrog-ai-balrog",
      "stars": null,
      "archived": null,
      "latest_release": null,
      "last_activity": null,
      "retrieval": "not-recorded"
    },
    {
      "id": "blendi-remade-sprite-sheet-creator",
      "stars": null,
      "archived": null,
      "latest_release": null,
      "last_activity": null,
      "retrieval": "not-recorded"
    },
    {
      "id": "buaacyw-meshanything",
      "stars": null,
      "archived": null,
      "latest_release": null,
      "last_activity": null,
      "retrieval": "not-recorded"
    },
    {
      "id": "buaacyw-meshanythingv2",
      "stars": null,
      "archived": null,
      "latest_release": null,
      "last_activity": null,
      "retrieval": "not-recorded"
    },
    {
      "id": "carson-katri-dream-textures",
      "stars": null,
      "archived": null,
      "latest_release": null,
      "last_activity": null,
      "retrieval": "not-recorded"
    },
    {
      "id": "chaofengc-awesome-image-quality-assessment",
      "stars": null,
      "archived": null,
      "latest_release": null,
      "last_activity": null,
      "retrieval": "not-recorded"
    },
    {
      "id": "chaofengc-iqa-pytorch",
      "stars": 3300,
      "archived": null,
      "latest_release": null,
      "last_activity": null,
      "retrieval": "approximate-source-snapshot"
    },
    {
      "id": "charmed-ai-tilemapgen",
      "stars": null,
      "archived": null,
      "latest_release": null,
      "last_activity": null,
      "retrieval": "not-recorded"
    },
    {
      "id": "chasemetoyer-gameplay-vision-llm",
      "stars": null,
      "archived": null,
      "latest_release": null,
      "last_activity": null,
      "retrieval": "not-recorded"
    },
    {
      "id": "codedpro-agentic-game-factory",
      "stars": null,
      "archived": null,
      "latest_release": null,
      "last_activity": null,
      "retrieval": "not-recorded"
    },
    {
      "id": "coding-solo-godot-mcp",
      "stars": 5000,
      "archived": null,
      "latest_release": null,
      "last_activity": null,
      "retrieval": "approximate-source-snapshot"
    },
    {
      "id": "comfy-org-comfyui",
      "stars": 122900,
      "archived": null,
      "latest_release": null,
      "last_activity": null,
      "retrieval": "approximate-source-snapshot"
    },
    {
      "id": "coplaydev-unity-mcp",
      "stars": 13000,
      "archived": null,
      "latest_release": null,
      "last_activity": null,
      "retrieval": "approximate-source-snapshot"
    },
    {
      "id": "coqui-ai-tts",
      "stars": null,
      "archived": null,
      "latest_release": null,
      "last_activity": null,
      "retrieval": "not-recorded"
    },
    {
      "id": "danielgatis-rembg",
      "stars": null,
      "archived": null,
      "latest_release": null,
      "last_activity": null,
      "retrieval": "not-recorded"
    },
    {
      "id": "declare-lab-tango",
      "stars": null,
      "archived": null,
      "latest_release": null,
      "last_activity": null,
      "retrieval": "not-recorded"
    },
    {
      "id": "dinghuanghao-openword",
      "stars": null,
      "archived": null,
      "latest_release": null,
      "last_activity": null,
      "retrieval": "not-recorded"
    },
    {
      "id": "donchitos-claude-code-game-studios",
      "stars": 23500,
      "archived": null,
      "latest_release": null,
      "last_activity": null,
      "retrieval": "approximate-source-snapshot"
    },
    {
      "id": "dreamgaussian-dreamgaussian",
      "stars": null,
      "archived": null,
      "latest_release": null,
      "last_activity": null,
      "retrieval": "not-recorded"
    },
    {
      "id": "dweam-team-world-arcade",
      "stars": null,
      "archived": null,
      "latest_release": null,
      "last_activity": null,
      "retrieval": "not-recorded"
    },
    {
      "id": "ece1786-2023-animyth",
      "stars": null,
      "archived": null,
      "latest_release": null,
      "last_activity": null,
      "retrieval": "not-recorded"
    },
    {
      "id": "edbeeching-godot-rl-agents",
      "stars": null,
      "archived": null,
      "latest_release": null,
      "last_activity": null,
      "retrieval": "not-recorded"
    },
    {
      "id": "eloialonso-diamond",
      "stars": null,
      "archived": null,
      "latest_release": null,
      "last_activity": null,
      "retrieval": "not-recorded"
    },
    {
      "id": "enigmalabsai-multiverse",
      "stars": null,
      "archived": null,
      "latest_release": null,
      "last_activity": null,
      "retrieval": "not-recorded"
    },
    {
      "id": "envy-ai-ai-rpg",
      "stars": null,
      "archived": null,
      "latest_release": null,
      "last_activity": null,
      "retrieval": "not-recorded"
    },
    {
      "id": "ericguo5513-momask-codes",
      "stars": null,
      "archived": null,
      "latest_release": null,
      "last_activity": null,
      "retrieval": "not-recorded"
    },
    {
      "id": "etched-ai-open-oasis",
      "stars": null,
      "archived": null,
      "latest_release": null,
      "last_activity": null,
      "retrieval": "not-recorded"
    },
    {
      "id": "eyamans-texel-studio",
      "stars": null,
      "archived": null,
      "latest_release": null,
      "last_activity": null,
      "retrieval": "not-recorded"
    },
    {
      "id": "facebookresearch-actionmesh",
      "stars": null,
      "archived": null,
      "latest_release": null,
      "last_activity": null,
      "retrieval": "not-recorded"
    },
    {
      "id": "facebookresearch-ai4animationpy",
      "stars": null,
      "archived": null,
      "latest_release": null,
      "last_activity": null,
      "retrieval": "not-recorded"
    },
    {